{
  "schemaVersion": "fixture-ui-smoke/v1",
  "kind": "fixture-ui-smoke.receipt",
  "adapter": {
    "name": "example-preview",
    "platform": "ios"
  },
  "startedAt": "2026-07-01T00:00:00Z",
  "completedAt": "2026-07-01T00:00:04Z",
  "result": "succeeded",
  "target": {
    "fixtureBundleIdentifier": "com.example.app.fixture",
    "fixtureMode": "simulator-sterile-demo",
    "nonFixtureAppsTouched": false,
    "physicalDeviceActions": false
  },
  "commands": [
    {
      "id": "fixture-ui-smoke",
      "class": "ios-simulator-fixture-ui-smoke",
      "summary": "Ran deterministic iOS simulator fixture smoke",
      "durationSeconds": 4,
      "exitCode": 0,
      "result": "succeeded"
    }
  ],
  "evidence": {
    "logSubsystem": "com.example.app.fixture",
    "logTimeWindow": "2026-07-01T00:00:00Z/2026-07-01T00:00:04Z",
    "expectedEvents": [
      "fixture-view-appeared",
      "fixture-button-tapped",
      "fixture-label-updated"
    ],
    "observedEventCount": 3,
    "artifacts": [
      {
        "label": "sanitized-fixture-log",
        "path": "artifacts/fixture-ui-smoke/fixture.log",
        "sha256": "aaaaaaaaaaaaaaaaaaaaaaaaaaaaaaaaaaaaaaaaaaaaaaaaaaaaaaaaaaaaaaaa",
        "sizeBytes": 256
      },
      {
        "label": "fixture-result-bundle-summary",
        "path": "artifacts/fixture-ui-smoke/fixture.xcresult",
        "sha256": "bbbbbbbbbbbbbbbbbbbbbbbbbbbbbbbbbbbbbbbbbbbbbbbbbbbbbbbbbbbbbbbb",
        "sizeBytes": 4096
      }
    ],
    "withheld": [
      {
        "label": "raw-simulator-log",
        "reason": "raw simulator logs can contain local paths and private identifiers"
      },
      {
        "label": "screenshots",
        "reason": "the example receipt starts with screenshots disabled"
      }
    ]
  },
  "privacy": {
    "screenshots": "none",
    "rawAccessibilityTrees": false,
    "redactSecrets": true,
    "assertions": [
      "No physical-device action was requested.",
      "No private account data was used.",
      "No raw private accessibility tree was published."
    ]
  },
  "strongestAttemptedDisproof": "Checked iOS simulator targeting, fixture bundle targeting, expected events, artifact allowlist, and exclusion of physical-device actions."
}
